[
  {
    "id": "a2_1_trennbar_001",
    "level": "A2.1",
    "verb": "anschauen",
    "checklist_item": "trennbar",
    "task_type": "sentence_construction",
    "prompt": "Ich ___ ein__ gut__ Film ___.",
    "example_solutions": [
      "Ich schaue einen guten Film an."
    ],
    "english": "I watch a good film.",
    "hint": "anschauen is separable, takes Akkusativ, Präsens",
    "tags": [
      "akkusativ",
      "anschauen",
      "trennbar",
      "unbestimmt"
    ]
  },
  {
    "id": "a2_1_trennbar_002",
    "level": "A2.1",
    "verb": "mitbringen",
    "checklist_item": "trennbar",
    "task_type": "sentence_construction",
    "prompt": "Sie ___ mein__ neu__ Geschenk ___.",
    "example_solutions": [
      "Sie bringt mein neues Geschenk mit."
    ],
    "english": "She brings my new gift along.",
    "hint": "mitbringen is separable, takes Akkusativ, Präsens",
    "tags": [
      "akkusativ",
      "mitbringen",
      "trennbar",
      "possessiv"
    ]
  },
  {
    "id": "a2_1_trennbar_006",
    "level": "A2.1",
    "verb": "anrufen",
    "checklist_item": "trennbar",
    "task_type": "sentence_construction",
    "prompt": "Du ___ dein__ gut__ Freund ___.",
    "example_solutions": [
      "Du rufst deinen guten Freund an."
    ],
    "english": "You call your good friend.",
    "hint": "anrufen is separable, takes Akkusativ, Präsens",
    "tags": [
      "akkusativ",
      "anrufen",
      "trennbar",
      "possessiv"
    ]
  },
  {
    "id": "a2_1_trennbar_007",
    "level": "A2.1",
    "verb": "einkaufen",
    "checklist_item": "trennbar",
    "task_type": "sentence_construction",
    "prompt": "Wir ___ kein__ frisch__ Brot ___.",
    "example_solutions": [
      "Wir kaufen kein frisches Brot ein."
    ],
    "english": "We don't buy fresh bread.",
    "hint": "einkaufen is separable, takes Akkusativ, Präsens",
    "tags": [
      "akkusativ",
      "einkaufen",
      "trennbar",
      "kein"
    ]
  },
  {
    "id": "a2_1_trennbar_008",
    "level": "A2.1",
    "verb": "aufhören",
    "checklist_item": "trennbar",
    "task_type": "sentence_construction",
    "prompt": "Ich ___ mit ___ gut__ Arbeit ___.",
    "example_solutions": [
      "Ich höre mit der guten Arbeit auf."
    ],
    "english": "I stop with the good work.",
    "hint": "aufhören is separable, takes mit + Dativ, Präsens",
    "tags": [
      "dativ",
      "aufhören",
      "trennbar",
      "bestimmt"
    ]
  },
  {
    "id": "a2_1_trennbar_009",
    "level": "A2.1",
    "verb": "anschauen",
    "checklist_item": "trennbar",
    "task_type": "sentence_construction",
    "prompt": "Er ___ ___ gut__ Film ___.",
    "example_solutions": [
      "Er schaut den guten Film an."
    ],
    "english": "He watches the good film.",
    "hint": "anschauen is separable, takes Akkusativ, Präsens",
    "tags": [
      "akkusativ",
      "anschauen",
      "trennbar",
      "bestimmt"
    ]
  },
  {
    "id": "a2_1_trennbar_010",
    "level": "A2.1",
    "verb": "mitbringen",
    "checklist_item": "trennbar",
    "task_type": "sentence_construction",
    "prompt": "Sie ___ kein__ neu__ Geschenk ___.",
    "example_solutions": [
      "Sie bringt kein neues Geschenk mit."
    ],
    "english": "She brings no new gift.",
    "hint": "mitbringen is separable, takes Akkusativ, Präsens",
    "tags": [
      "akkusativ",
      "mitbringen",
      "trennbar",
      "kein"
    ]
  },
  {
    "id": "a2_1_trennbar_012",
    "level": "A2.1",
    "verb": "anrufen",
    "checklist_item": "trennbar",
    "task_type": "sentence_construction",
    "prompt": "Du ___ ein__ gut__ Freund ___.",
    "example_solutions": [
      "Du rufst einen guten Freund an."
    ],
    "english": "You call a good friend.",
    "hint": "anrufen is separable, takes Akkusativ, Präsens",
    "tags": [
      "akkusativ",
      "anrufen",
      "trennbar",
      "unbestimmt"
    ]
  }
]